{
  "case_id": "בג\"ץ 8987/22",
  "case_id_slug": "8987-22-levin-jsc",
  "case_name_he": "התנועה למען איכות השלטון בישראל ואח' נ' שר המשפטים ואח' (עתירות מאוחדות: בג\"ץ 99/23, בג\"ץ 179/23, בג\"ץ 1711/24, בג\"ץ 896/24)",
  "case_name_en": "Movement for Quality Government in Israel et al. v. Minister of Justice et al. (consolidated petitions: HCJ 99/23, HCJ 179/23, HCJ 1711/24, HCJ 896/24)",
  "ruling_date": "2024-09-12",
  "filing_date": null,
  "panel": [
    { "name_he": "יעל וילנר", "name_en": "Yael Willner", "role": "Justice", "slug": "willner" },
    { "name_he": "עופר גרוסקופף", "name_en": "Ofer Grosskopf", "role": "Justice", "slug": "grosskopf" },
    { "name_he": "אלכס שטיין", "name_en": "Alex Stein", "role": "Justice", "slug": "stein" }
  ],
  "petitioner_type": "NGO",
  "petitioner_name_he": "התנועה למען איכות השלטון בישראל (ועותרים נוספים בעתירות המאוחדות)",
  "petitioner_name_en": "Movement for Quality Government in Israel (with additional petitioners across the consolidated dockets)",
  "respondent": "Minister",
  "respondent_decision_he": "סירובו של שר המשפטים יריב לוין לכנס את הוועדה לבחירת שופטים לשם בחירת נשיא קבוע לבית המשפט העליון ולמינוי שופטים לבית המשפט העליון ולבתי המשפט המחוזיים, וכן סירובו לפרסם ברשומות את רשימת המועמדים לתפקיד הנשיא, במשך פרק זמן ממושך לאחר פרישת הנשיאה אסתר חיות באוקטובר 2023",
  "respondent_decision_en": "Justice Minister Yariv Levin's refusal to convene the Judicial Selection Committee for the purpose of electing a permanent President of the Supreme Court and for the purpose of appointing Supreme Court and District Court justices, and his refusal to publish in the official gazette (Reshumot) the list of candidates for the President position, over an extended period following the retirement of President Esther Hayut in October 2023",
  "doctrine_invoked": [
    "ultra_vires",
    "reasonableness"
  ],
  "outcome": "upheld",
  "vote_majority": 3,
  "vote_minority": 0,
  "majority_authors": [],
  "minority_authors": [],
  "official_url": "https://supremedecisions.court.gov.il/Home/Download?path=NetVerdicts/2025/1/2/2022-0-8987-62-2&fileName=4ffc7b6d16c8431d90ce364e5395ba33&type=2",
  "secondary_urls": [
    "https://en.idi.org.il/articles/55973",
    "https://en.idi.org.il/articles/55929",
    "https://www.jpost.com/breaking-news/article-816565",
    "https://www.timesofisrael.com/high-court-orders-levin-to-convence-judicial-selection-committee-on-sunday/",
    "https://www.timesofisrael.com/liveblog_entry/high-court-orders-levin-to-hold-judicial-selection-committee-vote-for-a-new-supreme-court-president/",
    "https://www.timesofisrael.com/liveblog_entry/judicial-selection-committee-finally-convenes-to-elect-supreme-court-chief-levin-absent/",
    "https://mqg.org.il/en/conditional-order-issued-against-justice-minister-levin-following-mqg-petition/"
  ],
  "summary_he": "הרכב של שלושה שופטים (וילנר, גרוסקופף, שטיין) הוציא פה אחד צו מוחלט המחייב את שר המשפטים יריב לוין לכנס את הוועדה לבחירת שופטים לבחירת נשיא קבוע לבית המשפט העליון, ולפרסם ברשומות את רשימת המועמדים לתפקיד תוך 14 ימים. בית המשפט קבע כי סעיף 7(א) לחוק בתי המשפט מטיל על השר חובה לפעול לשם מינוי שופטים, וכי מדיניות השר להתנות את כינוס הוועדה בהשגת הסכמה רחבה מאיינת את תכלית החוק.",
  "summary_en": "A three-justice panel (Willner, Grosskopf, Stein) unanimously issued an absolute order requiring Justice Minister Yariv Levin to convene the Judicial Selection Committee to elect a permanent President of the Supreme Court, and to publish in the official gazette the list of candidates within 14 days. The Court held that section 7(a) of the Courts Law imposes a duty on the Minister to act for the appointment of justices, and that the Minister's policy of conditioning the convening of the Committee on broad consensus negated the purpose of the statute.",
  "predicate_ag_opinion": null,
  "respondent_body": "Judicial Selection Committee",
  "compliance_state": "complied",
  "defiance_signals": "Following the September 12, 2024 mandatory order, Levin did not publish the candidate list or convene the Committee for a presidential vote within the 14-day window. On December 12, 2024, the High Court held a follow-up hearing on a petition to find Levin in contempt; the panel (including Acting President Amit) declined to hold Levin in contempt, characterizing contempt as reserved for extreme circumstances and noting some procedural steps had been taken, but ordered that a vote on a permanent Supreme Court president be held in the Committee by January 16, 2025. The Committee convened and elected Justice Yitzhak Amit as President on January 26, 2025; Levin was absent from that session. Sources: https://www.timesofisrael.com/liveblog_entry/high-court-orders-levin-to-hold-judicial-selection-committee-vote-for-a-new-supreme-court-president/ ; https://www.timesofisrael.com/liveblog_entry/judicial-selection-committee-finally-convenes-to-elect-supreme-court-chief-levin-absent/",
  "defiance_signals_sources": [
    "https://www.timesofisrael.com/liveblog_entry/high-court-orders-levin-to-hold-judicial-selection-committee-vote-for-a-new-supreme-court-president/",
    "https://www.timesofisrael.com/liveblog_entry/judicial-selection-committee-finally-convenes-to-elect-supreme-court-chief-levin-absent/",
    "https://en.idi.org.il/articles/55973"
  ],
  "tags": [
    "judicial-selection-committee",
    "appointment-block",
    "ministerial-duty",
    "supreme-court-president",
    "consolidated-petitions"
  ],
  "notes": "Structural decision: entered as a SINGLE ruling keyed to the primary mandatory order of September 12, 2024 (HCJ 8987/22 leads a cluster of consolidated petitions including HCJ 99/23, HCJ 179/23, HCJ 1711/24, HCJ 896/24). The December 12, 2024 follow-up ruling — which declined to hold Levin in contempt but issued an additional deadline — is documented in defiance_signals rather than as a separate ruling, because (a) it is procedurally subordinate to the September 12 mandatory order (a compliance-enforcement step within the same proceeding rather than an independent disposition on the merits), and (b) it would not be analytically parallel to the project's other 'Court declined' entry (Zini, 427/10/25), where the Court declined to intervene on the merits of an appointment; here the Court declined a remedial tool while reaffirming the underlying mandatory order. Panel composition varied across sittings in the cluster: the September 12, 2024 absolute order was issued by Willner, Grosskopf, and Stein; the December 12, 2024 follow-up panel included Acting President Yitzhak Amit and additional justices. Vote was unanimous on substance across all sittings. Compliance was achieved on January 26, 2025, when the Committee convened and elected Justice Amit as President; Levin did not attend that session. The official URL points to a court document filed January 2, 2025 within the case file (NetVerdicts/2025/1/2/2022-0-8987-62-2), which appears to be a procedural record in the 8987/22 docket. Doctrine: 'ultra_vires' is used here for the Court's finding that the Minister failed to exercise a mandatory statutory power under section 7(a) of the Courts Law (closest mapping in the controlled vocabulary to ministerial-duty-to-exercise-statutory-authority); 'reasonableness' captures the Court's secondary analysis of the Minister's stated policy of conditioning convening on broad consensus. Separation-of-powers and judicial-independence framings discussed in the underlying petitions are not separately enumerable in the project's doctrine vocabulary."
}
